{"iteration":"gate3-forced-revert","phase":"gate3","config":{"semanticTopK":0,"episodicTopK":0,"graphMaxResults":20,"contextMaxTokens":200},"utility":-0.0025115384615384618,"meanRecall":0,"meanTokens":50.23076923076923,"meanMrr":0,"parentUtility":0.40854615384615384,"decision":"revert"}
{"iteration":"gate3-forced-keep","phase":"gate3","config":{"semanticTopK":20,"episodicTopK":10,"graphMaxResults":20,"contextMaxTokens":4000},"utility":0.40854615384615384,"meanRecall":0.5,"meanTokens":1829.076923076923,"meanMrr":0,"parentUtility":-0.0025115384615384618,"decision":"keep"}
{"iteration":0,"phase":"baseline","config":{"semanticTopK":5,"episodicTopK":3,"graphMaxResults":20,"contextMaxTokens":1200},"utility":0.10971153846153847,"meanRecall":0.15384615384615385,"meanTokens":882.6923076923077,"meanMrr":0,"decision":"keep"}
{"iteration":1,"phase":"loop","mode":"explore","config":{"semanticTopK":20,"episodicTopK":7,"graphMaxResults":20,"contextMaxTokens":4000},"utility":0.2579923076923077,"meanRecall":0.34615384615384615,"meanTokens":1763.2307692307693,"meanMrr":0,"parentUtility":0.10971153846153847,"currentUtility":0.2579923076923077,"decision":"keep"}
{"iteration":1,"phase":"checkpoint","config":{"semanticTopK":20,"episodicTopK":7,"graphMaxResults":20,"contextMaxTokens":4000},"e2eAccuracy":0,"n":8,"decision":"check"}
{"iteration":2,"phase":"loop","mode":"exploit","config":{"semanticTopK":23,"episodicTopK":7,"graphMaxResults":20,"contextMaxTokens":4000},"utility":0.24974999999999997,"meanRecall":0.34615384615384615,"meanTokens":1928.076923076923,"meanMrr":0,"parentUtility":0.2579923076923077,"currentUtility":0.2579923076923077,"decision":"revert"}
{"iteration":3,"phase":"loop","mode":"exploit","config":{"semanticTopK":23,"episodicTopK":7,"graphMaxResults":20,"contextMaxTokens":4000},"utility":0.2497653846153846,"meanRecall":0.34615384615384615,"meanTokens":1927.7692307692307,"meanMrr":0,"parentUtility":0.2579923076923077,"currentUtility":0.2579923076923077,"decision":"revert"}
{"iteration":4,"phase":"loop","mode":"explore","config":{"semanticTopK":20,"episodicTopK":13,"graphMaxResults":20,"contextMaxTokens":4000},"utility":0.5900269230769231,"meanRecall":0.6923076923076923,"meanTokens":2045.6153846153845,"meanMrr":0,"parentUtility":0.2579923076923077,"currentUtility":0.5900269230769231,"decision":"keep"}
{"iteration":5,"phase":"loop","mode":"explore","config":{"semanticTopK":23,"episodicTopK":7,"graphMaxResults":20,"contextMaxTokens":4000},"utility":0.2497653846153846,"meanRecall":0.34615384615384615,"meanTokens":1927.7692307692307,"meanMrr":0,"parentUtility":0.5900269230769231,"currentUtility":0.5900269230769231,"decision":"revert"}
{"iteration":6,"phase":"loop","mode":"exploit","config":{"semanticTopK":20,"episodicTopK":13,"graphMaxResults":20,"contextMaxTokens":3600},"utility":0.5900269230769231,"meanRecall":0.6923076923076923,"meanTokens":2045.6153846153845,"meanMrr":0,"parentUtility":0.5900269230769231,"currentUtility":0.5900269230769231,"decision":"revert"}
{"iteration":7,"phase":"loop","mode":"exploit","config":{"semanticTopK":20,"episodicTopK":12,"graphMaxResults":20,"contextMaxTokens":4000},"utility":0.5904038461538461,"meanRecall":0.6923076923076923,"meanTokens":2038.076923076923,"meanMrr":0,"parentUtility":0.5900269230769231,"currentUtility":0.5900269230769231,"decision":"revert"}
{"iteration":8,"phase":"loop","mode":"exploit","config":{"semanticTopK":20,"episodicTopK":13,"graphMaxResults":20,"contextMaxTokens":3750},"utility":0.5900269230769231,"meanRecall":0.6923076923076923,"meanTokens":2045.6153846153845,"meanMrr":0,"parentUtility":0.5900269230769231,"currentUtility":0.5900269230769231,"decision":"revert"}
{"iteration":9,"phase":"loop","mode":"exploit","config":{"semanticTopK":20,"episodicTopK":13,"graphMaxResults":20,"contextMaxTokens":3800},"utility":0.5900269230769231,"meanRecall":0.6923076923076923,"meanTokens":2045.6153846153845,"meanMrr":0,"parentUtility":0.5900269230769231,"currentUtility":0.5900269230769231,"decision":"revert"}
{"iteration":10,"phase":"loop","mode":"exploit","config":{"semanticTopK":20,"episodicTopK":13,"graphMaxResults":20,"contextMaxTokens":3950},"utility":0.5900269230769231,"meanRecall":0.6923076923076923,"meanTokens":2045.6153846153845,"meanMrr":0,"parentUtility":0.5900269230769231,"currentUtility":0.5900269230769231,"decision":"revert"}
{"iteration":11,"phase":"loop","mode":"exploit","config":{"semanticTopK":24,"episodicTopK":13,"graphMaxResults":20,"contextMaxTokens":4000},"utility":0.5900269230769231,"meanRecall":0.6923076923076923,"meanTokens":2045.6153846153845,"meanMrr":0,"parentUtility":0.5900269230769231,"currentUtility":0.5900269230769231,"decision":"revert"}
{"iteration":12,"phase":"loop","mode":"exploit","config":{"semanticTopK":18,"episodicTopK":13,"graphMaxResults":20,"contextMaxTokens":4000},"utility":0.5900269230769231,"meanRecall":0.6923076923076923,"meanTokens":2045.6153846153845,"meanMrr":0,"parentUtility":0.5900269230769231,"currentUtility":0.5900269230769231,"decision":"revert"}
{"iteration":13,"phase":"loop","mode":"exploit","config":{"semanticTopK":16,"episodicTopK":13,"graphMaxResults":20,"contextMaxTokens":4000},"utility":0.5900269230769231,"meanRecall":0.6923076923076923,"meanTokens":2045.6153846153845,"meanMrr":0,"parentUtility":0.5900269230769231,"currentUtility":0.5900269230769231,"decision":"revert"}
{"iteration":14,"phase":"loop","mode":"exploit","config":{"semanticTopK":17,"episodicTopK":13,"graphMaxResults":20,"contextMaxTokens":4000},"utility":0.5900269230769231,"meanRecall":0.6923076923076923,"meanTokens":2045.6153846153845,"meanMrr":0,"parentUtility":0.5900269230769231,"currentUtility":0.5900269230769231,"decision":"revert"}
{"iteration":15,"phase":"loop","mode":"exploit","config":{"semanticTopK":20,"episodicTopK":13,"graphMaxResults":20,"contextMaxTokens":3900},"utility":0.5900269230769231,"meanRecall":0.6923076923076923,"meanTokens":2045.6153846153845,"meanMrr":0,"parentUtility":0.5900269230769231,"currentUtility":0.5900269230769231,"decision":"revert"}
{"iteration":16,"phase":"loop","mode":"exploit","config":{"semanticTopK":23,"episodicTopK":13,"graphMaxResults":20,"contextMaxTokens":4000},"utility":0.5900269230769231,"meanRecall":0.6923076923076923,"meanTokens":2045.6153846153845,"meanMrr":0,"parentUtility":0.5900269230769231,"currentUtility":0.5900269230769231,"decision":"revert"}
{"iteration":17,"phase":"loop","mode":"exploit","config":{"semanticTopK":20,"episodicTopK":16,"graphMaxResults":20,"contextMaxTokens":4000},"utility":0.6658884615384616,"meanRecall":0.7692307692307693,"meanTokens":2066.846153846154,"meanMrr":0,"parentUtility":0.5900269230769231,"currentUtility":0.6658884615384616,"decision":"keep"}
{"iteration":18,"phase":"loop","mode":"exploit","config":{"semanticTopK":20,"episodicTopK":14,"graphMaxResults":20,"contextMaxTokens":4000},"utility":0.5896730769230769,"meanRecall":0.6923076923076923,"meanTokens":2052.6923076923076,"meanMrr":0,"parentUtility":0.6658884615384616,"currentUtility":0.6658884615384616,"decision":"revert"}
{"iteration":19,"phase":"loop","mode":"exploit","config":{"semanticTopK":21,"episodicTopK":16,"graphMaxResults":20,"contextMaxTokens":4000},"utility":0.6658884615384616,"meanRecall":0.7692307692307693,"meanTokens":2066.846153846154,"meanMrr":0,"parentUtility":0.6658884615384616,"currentUtility":0.6658884615384616,"decision":"revert"}
{"iteration":20,"phase":"loop","mode":"exploit","config":{"semanticTopK":20,"episodicTopK":16,"graphMaxResults":20,"contextMaxTokens":4000},"utility":0.6658884615384616,"meanRecall":0.7692307692307693,"meanTokens":2066.846153846154,"meanMrr":0,"parentUtility":0.6658884615384616,"currentUtility":0.6658884615384616,"decision":"revert"}
{"iteration":21,"phase":"loop","mode":"exploit","config":{"semanticTopK":20,"episodicTopK":16,"graphMaxResults":20,"contextMaxTokens":4000},"utility":0.6658884615384616,"meanRecall":0.7692307692307693,"meanTokens":2066.846153846154,"meanMrr":0,"parentUtility":0.6658884615384616,"currentUtility":0.6658884615384616,"decision":"revert"}
{"iteration":22,"phase":"loop","mode":"explore","config":{"semanticTopK":16,"episodicTopK":13,"graphMaxResults":20,"contextMaxTokens":4000},"utility":0.5900269230769231,"meanRecall":0.6923076923076923,"meanTokens":2045.6153846153845,"meanMrr":0,"parentUtility":0.6658884615384616,"currentUtility":0.6658884615384616,"decision":"revert"}
{"iteration":23,"phase":"loop","mode":"exploit","config":{"semanticTopK":20,"episodicTopK":13,"graphMaxResults":20,"contextMaxTokens":4000},"utility":0.5900269230769231,"meanRecall":0.6923076923076923,"meanTokens":2045.6153846153845,"meanMrr":0,"parentUtility":0.6658884615384616,"currentUtility":0.6658884615384616,"decision":"revert"}
{"iteration":24,"phase":"loop","mode":"exploit","config":{"semanticTopK":20,"episodicTopK":15,"graphMaxResults":20,"contextMaxTokens":4000},"utility":0.6277730769230768,"meanRecall":0.7307692307692307,"meanTokens":2059.923076923077,"meanMrr":0,"parentUtility":0.6658884615384616,"currentUtility":0.6658884615384616,"decision":"revert"}
{"iteration":25,"phase":"loop","mode":"exploit","config":{"semanticTopK":22,"episodicTopK":16,"graphMaxResults":20,"contextMaxTokens":4000},"utility":0.6658884615384616,"meanRecall":0.7692307692307693,"meanTokens":2066.846153846154,"meanMrr":0,"parentUtility":0.6658884615384616,"currentUtility":0.6658884615384616,"decision":"revert"}
{"iteration":25,"phase":"heldout-retrieval","config":{"semanticTopK":20,"episodicTopK":16,"graphMaxResults":20,"contextMaxTokens":4000},"utility":0.3456961538461539,"meanRecall":0.46153846153846156,"meanTokens":2316.846153846154,"meanMrr":0.15384615384615385,"decision":"check"}
{"iteration":26,"phase":"loop","mode":"exploit","config":{"semanticTopK":24,"episodicTopK":16,"graphMaxResults":20,"contextMaxTokens":4000},"utility":0.6657865384615385,"meanRecall":0.7692307692307693,"meanTokens":2068.8846153846152,"meanMrr":0,"parentUtility":0.6658884615384616,"currentUtility":0.6658884615384616,"decision":"revert"}
{"iteration":27,"phase":"loop","mode":"explore","config":{"semanticTopK":20,"episodicTopK":13,"graphMaxResults":20,"contextMaxTokens":4000},"utility":0.588323076923077,"meanRecall":0.6923076923076923,"meanTokens":2079.6923076923076,"meanMrr":0,"parentUtility":0.6658884615384616,"currentUtility":0.6658884615384616,"decision":"revert"}
{"iteration":28,"phase":"loop","mode":"exploit","config":{"semanticTopK":20,"episodicTopK":16,"graphMaxResults":20,"contextMaxTokens":3950},"utility":0.6637038461538463,"meanRecall":0.7692307692307693,"meanTokens":2110.5384615384614,"meanMrr":0,"parentUtility":0.6658884615384616,"currentUtility":0.6658884615384616,"decision":"revert"}
{"iteration":29,"phase":"loop","mode":"exploit","config":{"semanticTopK":20,"episodicTopK":15,"graphMaxResults":20,"contextMaxTokens":4000},"utility":0.6289788461538461,"meanRecall":0.7307692307692307,"meanTokens":2035.8076923076924,"meanMrr":0,"parentUtility":0.6658884615384616,"currentUtility":0.6658884615384616,"decision":"revert"}
{"iteration":30,"phase":"loop","mode":"explore","config":{"semanticTopK":1,"episodicTopK":0,"graphMaxResults":20,"contextMaxTokens":200},"utility":-0.007573076923076923,"meanRecall":0,"meanTokens":151.46153846153845,"meanMrr":0,"parentUtility":0.6658884615384616,"currentUtility":0.6658884615384616,"decision":"revert"}
{"iteration":31,"phase":"loop","mode":"exploit","config":{"semanticTopK":20,"episodicTopK":14,"graphMaxResults":20,"contextMaxTokens":4000},"utility":0.5864557692307693,"meanRecall":0.6923076923076923,"meanTokens":2117.0384615384614,"meanMrr":0,"parentUtility":0.6658884615384616,"currentUtility":0.6658884615384616,"decision":"revert"}
{"iteration":32,"phase":"loop","mode":"exploit","config":{"semanticTopK":20,"episodicTopK":16,"graphMaxResults":20,"contextMaxTokens":4000},"utility":0.6623653846153846,"meanRecall":0.7692307692307693,"meanTokens":2137.3076923076924,"meanMrr":0,"parentUtility":0.6658884615384616,"currentUtility":0.6658884615384616,"decision":"revert"}
{"iteration":33,"phase":"loop","mode":"exploit","config":{"semanticTopK":20,"episodicTopK":16,"graphMaxResults":20,"contextMaxTokens":4000},"utility":0.6623653846153846,"meanRecall":0.7692307692307693,"meanTokens":2137.3076923076924,"meanMrr":0,"parentUtility":0.6658884615384616,"currentUtility":0.6658884615384616,"decision":"revert"}
{"iteration":34,"phase":"loop","mode":"exploit","config":{"semanticTopK":20,"episodicTopK":17,"graphMaxResults":20,"contextMaxTokens":4000},"utility":0.6623653846153846,"meanRecall":0.7692307692307693,"meanTokens":2137.3076923076924,"meanMrr":0,"parentUtility":0.6658884615384616,"currentUtility":0.6658884615384616,"decision":"revert"}
{"iteration":35,"phase":"loop","mode":"exploit","config":{"semanticTopK":23,"episodicTopK":16,"graphMaxResults":20,"contextMaxTokens":4000},"utility":0.6623653846153846,"meanRecall":0.7692307692307693,"meanTokens":2137.3076923076924,"meanMrr":0,"parentUtility":0.6658884615384616,"currentUtility":0.6658884615384616,"decision":"revert"}
{"iteration":36,"phase":"loop","mode":"exploit","config":{"semanticTopK":20,"episodicTopK":16,"graphMaxResults":20,"contextMaxTokens":4000},"utility":0.6623653846153846,"meanRecall":0.7692307692307693,"meanTokens":2137.3076923076924,"meanMrr":0,"parentUtility":0.6658884615384616,"currentUtility":0.6658884615384616,"decision":"revert"}
{"iteration":37,"phase":"loop","mode":"exploit","config":{"semanticTopK":22,"episodicTopK":16,"graphMaxResults":20,"contextMaxTokens":4000},"utility":0.6623653846153846,"meanRecall":0.7692307692307693,"meanTokens":2137.3076923076924,"meanMrr":0,"parentUtility":0.6658884615384616,"currentUtility":0.6658884615384616,"decision":"revert"}
{"iteration":38,"phase":"loop","mode":"exploit","config":{"semanticTopK":20,"episodicTopK":16,"graphMaxResults":20,"contextMaxTokens":4000},"utility":0.6623653846153846,"meanRecall":0.7692307692307693,"meanTokens":2137.3076923076924,"meanMrr":0,"parentUtility":0.6658884615384616,"currentUtility":0.6658884615384616,"decision":"revert"}
{"iteration":39,"phase":"loop","mode":"exploit","config":{"semanticTopK":16,"episodicTopK":16,"graphMaxResults":20,"contextMaxTokens":4000},"utility":0.6623653846153846,"meanRecall":0.7692307692307693,"meanTokens":2137.3076923076924,"meanMrr":0,"parentUtility":0.6658884615384616,"currentUtility":0.6658884615384616,"decision":"revert"}
{"iteration":40,"phase":"loop","mode":"exploit","config":{"semanticTopK":20,"episodicTopK":15,"graphMaxResults":20,"contextMaxTokens":4000},"utility":0.62425,"meanRecall":0.7307692307692307,"meanTokens":2130.3846153846152,"meanMrr":0,"parentUtility":0.6658884615384616,"currentUtility":0.6658884615384616,"decision":"revert"}
{"iteration":41,"phase":"loop","mode":"exploit","config":{"semanticTopK":20,"episodicTopK":16,"graphMaxResults":20,"contextMaxTokens":3700},"utility":0.6623653846153846,"meanRecall":0.7692307692307693,"meanTokens":2137.3076923076924,"meanMrr":0,"parentUtility":0.6658884615384616,"currentUtility":0.6658884615384616,"decision":"revert"}
{"iteration":42,"phase":"loop","mode":"exploit","config":{"semanticTopK":20,"episodicTopK":17,"graphMaxResults":20,"contextMaxTokens":4000},"utility":0.6623653846153846,"meanRecall":0.7692307692307693,"meanTokens":2137.3076923076924,"meanMrr":0,"parentUtility":0.6658884615384616,"currentUtility":0.6658884615384616,"decision":"revert"}
{"iteration":43,"phase":"loop","mode":"restart","config":{"semanticTopK":19,"episodicTopK":3,"graphMaxResults":20,"contextMaxTokens":500},"utility":-0.020496153846153848,"meanRecall":0,"meanTokens":409.9230769230769,"meanMrr":0,"parentUtility":null,"currentUtility":0.6658884615384616,"decision":"revert"}
{"iteration":44,"phase":"loop","mode":"exploit","config":{"semanticTopK":20,"episodicTopK":16,"graphMaxResults":20,"contextMaxTokens":4000},"utility":0.6623653846153846,"meanRecall":0.7692307692307693,"meanTokens":2137.3076923076924,"meanMrr":0,"parentUtility":0.6658884615384616,"currentUtility":0.6658884615384616,"decision":"revert"}
{"iteration":45,"phase":"loop","mode":"explore","config":{"semanticTopK":20,"episodicTopK":15,"graphMaxResults":20,"contextMaxTokens":3900},"utility":0.62425,"meanRecall":0.7307692307692307,"meanTokens":2130.3846153846152,"meanMrr":0,"parentUtility":0.6658884615384616,"currentUtility":0.6658884615384616,"decision":"revert"}
{"iteration":46,"phase":"loop","mode":"exploit","config":{"semanticTopK":24,"episodicTopK":16,"graphMaxResults":20,"contextMaxTokens":4000},"utility":0.6623653846153846,"meanRecall":0.7692307692307693,"meanTokens":2137.3076923076924,"meanMrr":0,"parentUtility":0.6658884615384616,"currentUtility":0.6658884615384616,"decision":"revert"}
{"iteration":47,"phase":"loop","mode":"explore","config":{"semanticTopK":16,"episodicTopK":11,"graphMaxResults":20,"contextMaxTokens":4000},"utility":0.47255769230769223,"meanRecall":0.5769230769230769,"meanTokens":2087.3076923076924,"meanMrr":0,"parentUtility":0.6658884615384616,"currentUtility":0.6658884615384616,"decision":"revert"}
{"iteration":48,"phase":"loop","mode":"explore","config":{"semanticTopK":16,"episodicTopK":11,"graphMaxResults":20,"contextMaxTokens":4000},"utility":0.47255769230769223,"meanRecall":0.5769230769230769,"meanTokens":2087.3076923076924,"meanMrr":0,"parentUtility":0.6658884615384616,"currentUtility":0.6658884615384616,"decision":"revert"}
{"iteration":49,"phase":"loop","mode":"exploit","config":{"semanticTopK":23,"episodicTopK":16,"graphMaxResults":20,"contextMaxTokens":4000},"utility":0.6623653846153846,"meanRecall":0.7692307692307693,"meanTokens":2137.3076923076924,"meanMrr":0,"parentUtility":0.6658884615384616,"currentUtility":0.6658884615384616,"decision":"revert"}
{"iteration":50,"phase":"loop","mode":"exploit","config":{"semanticTopK":20,"episodicTopK":16,"graphMaxResults":20,"contextMaxTokens":4000},"utility":0.6623653846153846,"meanRecall":0.7692307692307693,"meanTokens":2137.3076923076924,"meanMrr":0,"parentUtility":0.6658884615384616,"currentUtility":0.6658884615384616,"decision":"revert"}
{"iteration":50,"phase":"heldout-retrieval","config":{"semanticTopK":20,"episodicTopK":16,"graphMaxResults":20,"contextMaxTokens":4000},"utility":0.34210769230769233,"meanRecall":0.46153846153846156,"meanTokens":2388.6153846153848,"meanMrr":0.15384615384615385,"decision":"check"}
{"iteration":51,"phase":"loop","mode":"explore","config":{"semanticTopK":20,"episodicTopK":11,"graphMaxResults":20,"contextMaxTokens":4000},"utility":0.47255769230769223,"meanRecall":0.5769230769230769,"meanTokens":2087.3076923076924,"meanMrr":0,"parentUtility":0.6658884615384616,"currentUtility":0.6658884615384616,"decision":"revert"}
{"iteration":52,"phase":"loop","mode":"exploit","config":{"semanticTopK":20,"episodicTopK":20,"graphMaxResults":20,"contextMaxTokens":4000},"utility":0.6625134615384616,"meanRecall":0.7692307692307693,"meanTokens":2134.346153846154,"meanMrr":0,"parentUtility":0.6658884615384616,"currentUtility":0.6658884615384616,"decision":"revert"}
{"iteration":53,"phase":"loop","mode":"exploit","config":{"semanticTopK":19,"episodicTopK":16,"graphMaxResults":20,"contextMaxTokens":4000},"utility":0.6624865384615385,"meanRecall":0.7692307692307693,"meanTokens":2134.8846153846152,"meanMrr":0,"parentUtility":0.6658884615384616,"currentUtility":0.6658884615384616,"decision":"revert"}
{"iteration":54,"phase":"loop","mode":"exploit","config":{"semanticTopK":21,"episodicTopK":16,"graphMaxResults":20,"contextMaxTokens":4000},"utility":0.662525,"meanRecall":0.7692307692307693,"meanTokens":2134.1153846153848,"meanMrr":0,"parentUtility":0.6658884615384616,"currentUtility":0.6658884615384616,"decision":"revert"}
{"iteration":55,"phase":"loop","mode":"exploit","config":{"semanticTopK":20,"episodicTopK":16,"graphMaxResults":20,"contextMaxTokens":4000},"utility":0.662525,"meanRecall":0.7692307692307693,"meanTokens":2134.1153846153848,"meanMrr":0,"parentUtility":0.6658884615384616,"currentUtility":0.6658884615384616,"decision":"revert"}
{"iteration":56,"phase":"loop","mode":"exploit","config":{"semanticTopK":20,"episodicTopK":16,"graphMaxResults":20,"contextMaxTokens":3850},"utility":0.662525,"meanRecall":0.7692307692307693,"meanTokens":2134.1153846153848,"meanMrr":0,"parentUtility":0.6658884615384616,"currentUtility":0.6658884615384616,"decision":"revert"}
{"iteration":57,"phase":"loop","mode":"exploit","config":{"semanticTopK":20,"episodicTopK":16,"graphMaxResults":20,"contextMaxTokens":3800},"utility":0.662525,"meanRecall":0.7692307692307693,"meanTokens":2134.1153846153848,"meanMrr":0,"parentUtility":0.6658884615384616,"currentUtility":0.6658884615384616,"decision":"revert"}
{"iteration":58,"phase":"loop","mode":"explore","config":{"semanticTopK":23,"episodicTopK":16,"graphMaxResults":20,"contextMaxTokens":4000},"utility":0.662525,"meanRecall":0.7692307692307693,"meanTokens":2134.1153846153848,"meanMrr":0,"parentUtility":0.6658884615384616,"currentUtility":0.6658884615384616,"decision":"revert"}
{"iteration":59,"phase":"loop","mode":"explore","config":{"semanticTopK":23,"episodicTopK":13,"graphMaxResults":20,"contextMaxTokens":3800},"utility":0.5866634615384615,"meanRecall":0.6923076923076923,"meanTokens":2112.8846153846152,"meanMrr":0,"parentUtility":0.6658884615384616,"currentUtility":0.6658884615384616,"decision":"revert"}
{"iteration":60,"phase":"loop","mode":"exploit","config":{"semanticTopK":20,"episodicTopK":16,"graphMaxResults":20,"contextMaxTokens":4000},"utility":0.662525,"meanRecall":0.7692307692307693,"meanTokens":2134.1153846153848,"meanMrr":0,"parentUtility":0.6658884615384616,"currentUtility":0.6658884615384616,"decision":"revert"}
{"iteration":61,"phase":"loop","mode":"exploit","config":{"semanticTopK":19,"episodicTopK":16,"graphMaxResults":20,"contextMaxTokens":4000},"utility":0.662525,"meanRecall":0.7692307692307693,"meanTokens":2134.1153846153848,"meanMrr":0,"parentUtility":0.6658884615384616,"currentUtility":0.6658884615384616,"decision":"revert"}
