{"iteration":62,"phase":"loop","mode":"exploit","config":{"semanticTopK":16,"episodicTopK":16,"graphMaxResults":20,"contextMaxTokens":4000},"utility":0.662525,"meanRecall":0.7692307692307693,"meanTokens":2134.1153846153848,"meanMrr":0,"parentUtility":0.6658884615384616,"currentUtility":0.6658884615384616,"decision":"revert"}
{"iteration":63,"phase":"loop","mode":"exploit","config":{"semanticTopK":20,"episodicTopK":16,"graphMaxResults":20,"contextMaxTokens":4000},"utility":0.662525,"meanRecall":0.7692307692307693,"meanTokens":2134.1153846153848,"meanMrr":0,"parentUtility":0.6658884615384616,"currentUtility":0.6658884615384616,"decision":"revert"}
{"iteration":64,"phase":"loop","mode":"explore","config":{"semanticTopK":19,"episodicTopK":16,"graphMaxResults":20,"contextMaxTokens":4000},"utility":0.662525,"meanRecall":0.7692307692307693,"meanTokens":2134.1153846153848,"meanMrr":0,"parentUtility":0.6658884615384616,"currentUtility":0.6658884615384616,"decision":"revert"}
{"iteration":65,"phase":"loop","mode":"exploit","config":{"semanticTopK":16,"episodicTopK":16,"graphMaxResults":20,"contextMaxTokens":4000},"utility":0.662525,"meanRecall":0.7692307692307693,"meanTokens":2134.1153846153848,"meanMrr":0,"parentUtility":0.6658884615384616,"currentUtility":0.6658884615384616,"decision":"revert"}
{"iteration":66,"phase":"loop","mode":"explore","config":{"semanticTopK":17,"episodicTopK":13,"graphMaxResults":20,"contextMaxTokens":3950},"utility":0.5866634615384615,"meanRecall":0.6923076923076923,"meanTokens":2112.8846153846152,"meanMrr":0,"parentUtility":0.6658884615384616,"currentUtility":0.6658884615384616,"decision":"revert"}
{"iteration":67,"phase":"loop","mode":"exploit","config":{"semanticTopK":20,"episodicTopK":12,"graphMaxResults":20,"contextMaxTokens":4000},"utility":0.5870403846153845,"meanRecall":0.6923076923076923,"meanTokens":2105.346153846154,"meanMrr":0,"parentUtility":0.6658884615384616,"currentUtility":0.6658884615384616,"decision":"revert"}
{"iteration":68,"phase":"loop","mode":"restart","config":{"semanticTopK":25,"episodicTopK":2,"graphMaxResults":20,"contextMaxTokens":3800},"utility":-0.016913461538461544,"meanRecall":0.07692307692307693,"meanTokens":1876.7307692307693,"meanMrr":0,"parentUtility":null,"currentUtility":0.6658884615384616,"decision":"revert"}
{"iteration":69,"phase":"loop","mode":"exploit","config":{"semanticTopK":20,"episodicTopK":16,"graphMaxResults":20,"contextMaxTokens":4000},"utility":0.662525,"meanRecall":0.7692307692307693,"meanTokens":2134.1153846153848,"meanMrr":0,"parentUtility":0.6658884615384616,"currentUtility":0.6658884615384616,"decision":"revert"}
{"iteration":70,"phase":"loop","mode":"exploit","config":{"semanticTopK":20,"episodicTopK":16,"graphMaxResults":20,"contextMaxTokens":4000},"utility":0.662525,"meanRecall":0.7692307692307693,"meanTokens":2134.1153846153848,"meanMrr":0,"parentUtility":0.6658884615384616,"currentUtility":0.6658884615384616,"decision":"revert"}
{"iteration":71,"phase":"loop","mode":"exploit","config":{"semanticTopK":24,"episodicTopK":16,"graphMaxResults":20,"contextMaxTokens":4000},"utility":0.662525,"meanRecall":0.7692307692307693,"meanTokens":2134.1153846153848,"meanMrr":0,"parentUtility":0.6658884615384616,"currentUtility":0.6658884615384616,"decision":"revert"}
{"iteration":72,"phase":"loop","mode":"exploit","config":{"semanticTopK":16,"episodicTopK":16,"graphMaxResults":20,"contextMaxTokens":4000},"utility":0.662525,"meanRecall":0.7692307692307693,"meanTokens":2134.1153846153848,"meanMrr":0,"parentUtility":0.6658884615384616,"currentUtility":0.6658884615384616,"decision":"revert"}
{"iteration":73,"phase":"loop","mode":"explore","config":{"semanticTopK":23,"episodicTopK":16,"graphMaxResults":20,"contextMaxTokens":4000},"utility":0.662525,"meanRecall":0.7692307692307693,"meanTokens":2134.1153846153848,"meanMrr":0,"parentUtility":0.6658884615384616,"currentUtility":0.6658884615384616,"decision":"revert"}
{"iteration":74,"phase":"loop","mode":"exploit","config":{"semanticTopK":20,"episodicTopK":14,"graphMaxResults":20,"contextMaxTokens":4000},"utility":0.5863096153846153,"meanRecall":0.6923076923076923,"meanTokens":2119.9615384615386,"meanMrr":0,"parentUtility":0.6658884615384616,"currentUtility":0.6658884615384616,"decision":"revert"}
{"iteration":75,"phase":"loop","mode":"exploit","config":{"semanticTopK":20,"episodicTopK":16,"graphMaxResults":20,"contextMaxTokens":3650},"utility":0.662525,"meanRecall":0.7692307692307693,"meanTokens":2134.1153846153848,"meanMrr":0,"parentUtility":0.6658884615384616,"currentUtility":0.6658884615384616,"decision":"revert"}
{"iteration":75,"phase":"heldout-retrieval","config":{"semanticTopK":20,"episodicTopK":16,"graphMaxResults":20,"contextMaxTokens":4000},"utility":0.34210769230769233,"meanRecall":0.46153846153846156,"meanTokens":2388.6153846153848,"meanMrr":0.15384615384615385,"decision":"check"}
{"iteration":76,"phase":"loop","mode":"explore","config":{"semanticTopK":20,"episodicTopK":18,"graphMaxResults":20,"contextMaxTokens":4000},"utility":0.662525,"meanRecall":0.7692307692307693,"meanTokens":2134.1153846153848,"meanMrr":0,"parentUtility":0.6658884615384616,"currentUtility":0.6658884615384616,"decision":"revert"}
{"iteration":77,"phase":"loop","mode":"exploit","config":{"semanticTopK":20,"episodicTopK":20,"graphMaxResults":20,"contextMaxTokens":4000},"utility":0.662525,"meanRecall":0.7692307692307693,"meanTokens":2134.1153846153848,"meanMrr":0,"parentUtility":0.6658884615384616,"currentUtility":0.6658884615384616,"decision":"revert"}
{"iteration":78,"phase":"loop","mode":"exploit","config":{"semanticTopK":20,"episodicTopK":19,"graphMaxResults":20,"contextMaxTokens":4000},"utility":0.662473076923077,"meanRecall":0.7692307692307693,"meanTokens":2135.153846153846,"meanMrr":0,"parentUtility":0.6658884615384616,"currentUtility":0.6658884615384616,"decision":"revert"}
{"iteration":79,"phase":"loop","mode":"exploit","config":{"semanticTopK":24,"episodicTopK":16,"graphMaxResults":20,"contextMaxTokens":4000},"utility":0.6624653846153846,"meanRecall":0.7692307692307693,"meanTokens":2135.3076923076924,"meanMrr":0,"parentUtility":0.6658884615384616,"currentUtility":0.6658884615384616,"decision":"revert"}
{"iteration":80,"phase":"loop","mode":"exploit","config":{"semanticTopK":20,"episodicTopK":17,"graphMaxResults":20,"contextMaxTokens":4000},"utility":0.6624596153846154,"meanRecall":0.7692307692307693,"meanTokens":2135.423076923077,"meanMrr":0,"parentUtility":0.6658884615384616,"currentUtility":0.6658884615384616,"decision":"revert"}
{"iteration":81,"phase":"loop","mode":"exploit","config":{"semanticTopK":23,"episodicTopK":16,"graphMaxResults":20,"contextMaxTokens":4000},"utility":0.662423076923077,"meanRecall":0.7692307692307693,"meanTokens":2136.153846153846,"meanMrr":0,"parentUtility":0.6658884615384616,"currentUtility":0.6658884615384616,"decision":"revert"}
{"iteration":82,"phase":"loop","mode":"exploit","config":{"semanticTopK":20,"episodicTopK":16,"graphMaxResults":20,"contextMaxTokens":3900},"utility":0.662423076923077,"meanRecall":0.7692307692307693,"meanTokens":2136.153846153846,"meanMrr":0,"parentUtility":0.6658884615384616,"currentUtility":0.6658884615384616,"decision":"revert"}
{"iteration":83,"phase":"loop","mode":"explore","config":{"semanticTopK":18,"episodicTopK":16,"graphMaxResults":20,"contextMaxTokens":4000},"utility":0.662423076923077,"meanRecall":0.7692307692307693,"meanTokens":2136.153846153846,"meanMrr":0,"parentUtility":0.6658884615384616,"currentUtility":0.6658884615384616,"decision":"revert"}
{"iteration":84,"phase":"loop","mode":"exploit","config":{"semanticTopK":22,"episodicTopK":16,"graphMaxResults":20,"contextMaxTokens":4000},"utility":0.662423076923077,"meanRecall":0.7692307692307693,"meanTokens":2136.153846153846,"meanMrr":0,"parentUtility":0.6658884615384616,"currentUtility":0.6658884615384616,"decision":"revert"}
{"iteration":85,"phase":"loop","mode":"exploit","config":{"semanticTopK":20,"episodicTopK":19,"graphMaxResults":20,"contextMaxTokens":4000},"utility":0.662423076923077,"meanRecall":0.7692307692307693,"meanTokens":2136.153846153846,"meanMrr":0,"parentUtility":0.6658884615384616,"currentUtility":0.6658884615384616,"decision":"revert"}
{"iteration":86,"phase":"loop","mode":"exploit","config":{"semanticTopK":17,"episodicTopK":16,"graphMaxResults":20,"contextMaxTokens":4000},"utility":0.662423076923077,"meanRecall":0.7692307692307693,"meanTokens":2136.153846153846,"meanMrr":0,"parentUtility":0.6658884615384616,"currentUtility":0.6658884615384616,"decision":"revert"}
{"iteration":87,"phase":"loop","mode":"explore","config":{"semanticTopK":16,"episodicTopK":16,"graphMaxResults":20,"contextMaxTokens":4000},"utility":0.662423076923077,"meanRecall":0.7692307692307693,"meanTokens":2136.153846153846,"meanMrr":0,"parentUtility":0.6658884615384616,"currentUtility":0.6658884615384616,"decision":"revert"}
{"iteration":88,"phase":"loop","mode":"exploit","config":{"semanticTopK":18,"episodicTopK":16,"graphMaxResults":20,"contextMaxTokens":4000},"utility":0.662423076923077,"meanRecall":0.7692307692307693,"meanTokens":2136.153846153846,"meanMrr":0,"parentUtility":0.6658884615384616,"currentUtility":0.6658884615384616,"decision":"revert"}
{"iteration":89,"phase":"loop","mode":"explore","config":{"semanticTopK":20,"episodicTopK":16,"graphMaxResults":20,"contextMaxTokens":3700},"utility":0.662423076923077,"meanRecall":0.7692307692307693,"meanTokens":2136.153846153846,"meanMrr":0,"parentUtility":0.6658884615384616,"currentUtility":0.6658884615384616,"decision":"revert"}
{"iteration":90,"phase":"loop","mode":"exploit","config":{"semanticTopK":23,"episodicTopK":16,"graphMaxResults":20,"contextMaxTokens":4000},"utility":0.662423076923077,"meanRecall":0.7692307692307693,"meanTokens":2136.153846153846,"meanMrr":0,"parentUtility":0.6658884615384616,"currentUtility":0.6658884615384616,"decision":"revert"}
{"iteration":91,"phase":"loop","mode":"exploit","config":{"semanticTopK":19,"episodicTopK":16,"graphMaxResults":20,"contextMaxTokens":4000},"utility":0.662423076923077,"meanRecall":0.7692307692307693,"meanTokens":2136.153846153846,"meanMrr":0,"parentUtility":0.6658884615384616,"currentUtility":0.6658884615384616,"decision":"revert"}
{"iteration":92,"phase":"loop","mode":"exploit","config":{"semanticTopK":20,"episodicTopK":16,"graphMaxResults":20,"contextMaxTokens":3600},"utility":0.662423076923077,"meanRecall":0.7692307692307693,"meanTokens":2136.153846153846,"meanMrr":0,"parentUtility":0.6658884615384616,"currentUtility":0.6658884615384616,"decision":"revert"}
{"iteration":93,"phase":"loop","mode":"restart","config":{"semanticTopK":7,"episodicTopK":9,"graphMaxResults":20,"contextMaxTokens":3400},"utility":0.423875,"meanRecall":0.5,"meanTokens":1522.5,"meanMrr":0,"parentUtility":null,"currentUtility":0.6658884615384616,"decision":"revert"}
{"iteration":94,"phase":"loop","mode":"exploit","config":{"semanticTopK":20,"episodicTopK":16,"graphMaxResults":20,"contextMaxTokens":3950},"utility":0.6622730769230769,"meanRecall":0.7692307692307693,"meanTokens":2139.153846153846,"meanMrr":0,"parentUtility":0.6658884615384616,"currentUtility":0.6658884615384616,"decision":"revert"}
{"iteration":95,"phase":"loop","mode":"exploit","config":{"semanticTopK":17,"episodicTopK":16,"graphMaxResults":20,"contextMaxTokens":4000},"utility":0.662325,"meanRecall":0.7692307692307693,"meanTokens":2138.1153846153848,"meanMrr":0,"parentUtility":0.6658884615384616,"currentUtility":0.6658884615384616,"decision":"revert"}
{"iteration":96,"phase":"loop","mode":"exploit","config":{"semanticTopK":20,"episodicTopK":15,"graphMaxResults":20,"contextMaxTokens":4000},"utility":0.6242096153846153,"meanRecall":0.7307692307692307,"meanTokens":2131.1923076923076,"meanMrr":0,"parentUtility":0.6658884615384616,"currentUtility":0.6658884615384616,"decision":"revert"}
{"iteration":97,"phase":"loop","mode":"exploit","config":{"semanticTopK":23,"episodicTopK":16,"graphMaxResults":20,"contextMaxTokens":4000},"utility":0.662325,"meanRecall":0.7692307692307693,"meanTokens":2138.1153846153848,"meanMrr":0,"parentUtility":0.6658884615384616,"currentUtility":0.6658884615384616,"decision":"revert"}
{"iteration":98,"phase":"loop","mode":"exploit","config":{"semanticTopK":21,"episodicTopK":16,"graphMaxResults":20,"contextMaxTokens":4000},"utility":0.662325,"meanRecall":0.7692307692307693,"meanTokens":2138.1153846153848,"meanMrr":0,"parentUtility":0.6658884615384616,"currentUtility":0.6658884615384616,"decision":"revert"}
{"iteration":99,"phase":"loop","mode":"exploit","config":{"semanticTopK":20,"episodicTopK":15,"graphMaxResults":20,"contextMaxTokens":4000},"utility":0.6242096153846153,"meanRecall":0.7307692307692307,"meanTokens":2131.1923076923076,"meanMrr":0,"parentUtility":0.6658884615384616,"currentUtility":0.6658884615384616,"decision":"revert"}
{"iteration":100,"phase":"loop","mode":"exploit","config":{"semanticTopK":19,"episodicTopK":16,"graphMaxResults":20,"contextMaxTokens":4000},"utility":0.662325,"meanRecall":0.7692307692307693,"meanTokens":2138.1153846153848,"meanMrr":0,"parentUtility":0.6658884615384616,"currentUtility":0.6658884615384616,"decision":"revert"}
{"iteration":100,"phase":"heldout-retrieval","config":{"semanticTopK":20,"episodicTopK":16,"graphMaxResults":20,"contextMaxTokens":4000},"utility":0.3423923076923077,"meanRecall":0.46153846153846156,"meanTokens":2382.923076923077,"meanMrr":0.15384615384615385,"decision":"check"}
{"iteration":101,"phase":"loop","mode":"exploit","config":{"semanticTopK":20,"episodicTopK":12,"graphMaxResults":20,"contextMaxTokens":4000},"utility":0.5868403846153846,"meanRecall":0.6923076923076923,"meanTokens":2109.346153846154,"meanMrr":0,"parentUtility":0.6658884615384616,"currentUtility":0.6658884615384616,"decision":"revert"}
{"iteration":102,"phase":"loop","mode":"explore","config":{"semanticTopK":20,"episodicTopK":8,"graphMaxResults":20,"contextMaxTokens":4000},"utility":0.322025,"meanRecall":0.4230769230769231,"meanTokens":2021.0384615384614,"meanMrr":0,"parentUtility":0.6658884615384616,"currentUtility":0.6658884615384616,"decision":"revert"}
{"iteration":103,"phase":"loop","mode":"exploit","config":{"semanticTopK":20,"episodicTopK":13,"graphMaxResults":20,"contextMaxTokens":4000},"utility":0.5864634615384615,"meanRecall":0.6923076923076923,"meanTokens":2116.8846153846152,"meanMrr":0,"parentUtility":0.6658884615384616,"currentUtility":0.6658884615384616,"decision":"revert"}
{"iteration":104,"phase":"loop","mode":"exploit","config":{"semanticTopK":23,"episodicTopK":16,"graphMaxResults":20,"contextMaxTokens":4000},"utility":0.662325,"meanRecall":0.7692307692307693,"meanTokens":2138.1153846153848,"meanMrr":0,"parentUtility":0.6658884615384616,"currentUtility":0.6658884615384616,"decision":"revert"}
{"iteration":105,"phase":"loop","mode":"exploit","config":{"semanticTopK":17,"episodicTopK":16,"graphMaxResults":20,"contextMaxTokens":4000},"utility":0.6623173076923077,"meanRecall":0.7692307692307693,"meanTokens":2138.269230769231,"meanMrr":0,"parentUtility":0.6658884615384616,"currentUtility":0.6658884615384616,"decision":"revert"}
{"iteration":106,"phase":"loop","mode":"exploit","config":{"semanticTopK":20,"episodicTopK":16,"graphMaxResults":20,"contextMaxTokens":4000},"utility":0.6622211538461539,"meanRecall":0.7692307692307693,"meanTokens":2140.1923076923076,"meanMrr":0,"parentUtility":0.6658884615384616,"currentUtility":0.6658884615384616,"decision":"revert"}
{"iteration":107,"phase":"loop","mode":"exploit","config":{"semanticTopK":17,"episodicTopK":16,"graphMaxResults":20,"contextMaxTokens":4000},"utility":0.6622269230769231,"meanRecall":0.7692307692307693,"meanTokens":2140.076923076923,"meanMrr":0,"parentUtility":0.6658884615384616,"currentUtility":0.6658884615384616,"decision":"revert"}
{"iteration":108,"phase":"loop","mode":"exploit","config":{"semanticTopK":20,"episodicTopK":16,"graphMaxResults":20,"contextMaxTokens":4000},"utility":0.6622269230769231,"meanRecall":0.7692307692307693,"meanTokens":2140.076923076923,"meanMrr":0,"parentUtility":0.6658884615384616,"currentUtility":0.6658884615384616,"decision":"revert"}
{"iteration":109,"phase":"loop","mode":"exploit","config":{"semanticTopK":20,"episodicTopK":20,"graphMaxResults":20,"contextMaxTokens":4000},"utility":0.6622269230769231,"meanRecall":0.7692307692307693,"meanTokens":2140.076923076923,"meanMrr":0,"parentUtility":0.6658884615384616,"currentUtility":0.6658884615384616,"decision":"revert"}
{"iteration":110,"phase":"loop","mode":"explore","config":{"semanticTopK":24,"episodicTopK":16,"graphMaxResults":20,"contextMaxTokens":3600},"utility":0.6622269230769231,"meanRecall":0.7692307692307693,"meanTokens":2140.076923076923,"meanMrr":0,"parentUtility":0.6658884615384616,"currentUtility":0.6658884615384616,"decision":"revert"}
{"iteration":111,"phase":"loop","mode":"exploit","config":{"semanticTopK":23,"episodicTopK":16,"graphMaxResults":20,"contextMaxTokens":4000},"utility":0.6623288461538462,"meanRecall":0.7692307692307693,"meanTokens":2138.0384615384614,"meanMrr":0,"parentUtility":0.6658884615384616,"currentUtility":0.6658884615384616,"decision":"revert"}
{"iteration":112,"phase":"loop","mode":"exploit","config":{"semanticTopK":16,"episodicTopK":16,"graphMaxResults":20,"contextMaxTokens":4000},"utility":0.6623288461538462,"meanRecall":0.7692307692307693,"meanTokens":2138.0384615384614,"meanMrr":0,"parentUtility":0.6658884615384616,"currentUtility":0.6658884615384616,"decision":"revert"}
{"iteration":113,"phase":"loop","mode":"exploit","config":{"semanticTopK":19,"episodicTopK":16,"graphMaxResults":20,"contextMaxTokens":4000},"utility":0.6623384615384615,"meanRecall":0.7692307692307693,"meanTokens":2137.846153846154,"meanMrr":0,"parentUtility":0.6658884615384616,"currentUtility":0.6658884615384616,"decision":"revert"}
{"iteration":114,"phase":"loop","mode":"exploit","config":{"semanticTopK":16,"episodicTopK":16,"graphMaxResults":20,"contextMaxTokens":4000},"utility":0.6623384615384615,"meanRecall":0.7692307692307693,"meanTokens":2137.846153846154,"meanMrr":0,"parentUtility":0.6658884615384616,"currentUtility":0.6658884615384616,"decision":"revert"}
{"iteration":115,"phase":"loop","mode":"exploit","config":{"semanticTopK":20,"episodicTopK":16,"graphMaxResults":20,"contextMaxTokens":3850},"utility":0.6623384615384615,"meanRecall":0.7692307692307693,"meanTokens":2137.846153846154,"meanMrr":0,"parentUtility":0.6658884615384616,"currentUtility":0.6658884615384616,"decision":"revert"}
{"iteration":116,"phase":"loop","mode":"exploit","config":{"semanticTopK":20,"episodicTopK":18,"graphMaxResults":20,"contextMaxTokens":4000},"utility":0.6623384615384615,"meanRecall":0.7692307692307693,"meanTokens":2137.846153846154,"meanMrr":0,"parentUtility":0.6658884615384616,"currentUtility":0.6658884615384616,"decision":"revert"}
{"iteration":117,"phase":"loop","mode":"exploit","config":{"semanticTopK":17,"episodicTopK":16,"graphMaxResults":20,"contextMaxTokens":4000},"utility":0.6623384615384615,"meanRecall":0.7692307692307693,"meanTokens":2137.846153846154,"meanMrr":0,"parentUtility":0.6658884615384616,"currentUtility":0.6658884615384616,"decision":"revert"}
