{"iteration":"gate3-forced-revert","phase":"gate3","config":{"semanticTopK":0,"episodicTopK":0,"graphMaxResults":20,"contextMaxTokens":200},"utility":-0.0025384615384615385,"meanRecall":0,"meanTokens":50.76923076923077,"meanMrr":0,"parentUtility":0.40846153846153843,"decision":"revert"}
{"iteration":"gate3-forced-keep","phase":"gate3","config":{"semanticTopK":20,"episodicTopK":10,"graphMaxResults":20,"contextMaxTokens":4000},"utility":0.40846153846153843,"meanRecall":0.5,"meanTokens":1830.7692307692307,"meanMrr":0.07692307692307693,"parentUtility":-0.0025384615384615385,"decision":"keep"}
{"iteration":0,"phase":"baseline","config":{"semanticTopK":5,"episodicTopK":3,"graphMaxResults":20,"contextMaxTokens":1200},"utility":0.18657307692307692,"meanRecall":0.23076923076923078,"meanTokens":883.9230769230769,"meanMrr":0.07692307692307693,"decision":"keep"}
{"iteration":1,"phase":"loop","mode":"explore","config":{"semanticTopK":20,"episodicTopK":10,"graphMaxResults":20,"contextMaxTokens":3900},"utility":0.4084019230769231,"meanRecall":0.5,"meanTokens":1831.9615384615386,"meanMrr":0.07692307692307693,"parentUtility":0.18657307692307692,"currentUtility":0.4084019230769231,"decision":"keep"}
{"iteration":2,"phase":"loop","mode":"exploit","config":{"semanticTopK":24,"episodicTopK":10,"graphMaxResults":20,"contextMaxTokens":3900},"utility":0.4083788461538461,"meanRecall":0.5,"meanTokens":1832.423076923077,"meanMrr":0.07692307692307693,"parentUtility":0.4084019230769231,"currentUtility":0.4084019230769231,"decision":"revert"}
{"iteration":3,"phase":"loop","mode":"exploit","config":{"semanticTopK":20,"episodicTopK":6,"graphMaxResults":20,"contextMaxTokens":3900},"utility":0.2589923076923077,"meanRecall":0.34615384615384615,"meanTokens":1743.2307692307693,"meanMrr":0.07692307692307693,"parentUtility":0.4084019230769231,"currentUtility":0.4084019230769231,"decision":"revert"}
